{
  "format": "reciprocal-delegation/0.1",
  "delegation_id": "RD-EXAMPLE-CONSEQUENTIAL-PASS-001",
  "object": {
    "kind": "external_action",
    "ref": "publish-one-named-static-release",
    "base_head": "source-head-before-publication"
  },
  "actor": {
    "role": "publisher",
    "aperture": "example-aperture"
  },
  "consequence_class": "consequential",
  "write_scope": [
    "named release target only"
  ],
  "no_touch": [
    "account-settings",
    "credentials",
    "licence-terms"
  ],
  "evidence_obligation": [
    "source head",
    "output hash",
    "public head",
    "served receipt"
  ],
  "closer": {
    "kind": "human",
    "ref": "Mark"
  },
  "authorization": {
    "required": true,
    "request_id": "AUTH-RD-EXAMPLE-001",
    "approval_token": "AUTHORIZE-RD-EXAMPLE-001",
    "approval_received": true,
    "approval_value": "AUTHORIZE-RD-EXAMPLE-001",
    "routine_phrase_is_not_authorization": true
  },
  "claim_binding": {
    "target_head": "source-head-before-publication",
    "moved_head_becomes_historical": true
  },
  "mutation_controls": {
    "mutates": true,
    "claim_before_build": true,
    "exact_head_before_push": true,
    "single_mutator": true
  },
  "repair_controls": {
    "is_repair": false,
    "defect_id": null,
    "matching_failure_control": null
  },
  "restoration": {
    "strategy": "forward_commit",
    "history_preserved": true
  },
  "witness": {
    "required": true,
    "name_delivery_plainly": true
  },
  "human_correction": {
    "expected_max_minutes": 60
  },
  "initiative": {
    "public_or_consequential": true,
    "max_unreviewed_minutes": 30,
    "max_unreviewed_actions": 1
  }
}
