{
  "format": "reciprocal-delegation/0.1",
  "delegation_id": "RD-EXAMPLE-REPAIR-FAIL-001",
  "object": {
    "kind": "file",
    "ref": "instrument/checker.py",
    "base_head": "instrument-head-before-repair"
  },
  "actor": {
    "role": "repair owner",
    "aperture": "example-aperture"
  },
  "consequence_class": "routine_reversible",
  "write_scope": [
    "instrument/checker.py",
    "instrument/tests/**"
  ],
  "no_touch": [
    "production/**"
  ],
  "evidence_obligation": [
    "named defect",
    "negative control",
    "exact-head receipt"
  ],
  "closer": {
    "kind": "named_role",
    "ref": "integration owner"
  },
  "authorization": {
    "required": false,
    "request_id": null,
    "approval_token": null,
    "approval_received": false,
    "approval_value": null,
    "routine_phrase_is_not_authorization": true
  },
  "claim_binding": {
    "target_head": "instrument-head-before-repair",
    "moved_head_becomes_historical": true
  },
  "mutation_controls": {
    "mutates": true,
    "claim_before_build": true,
    "exact_head_before_push": true,
    "single_mutator": true
  },
  "repair_controls": {
    "is_repair": true,
    "defect_id": "DEFECT-42",
    "matching_failure_control": null
  },
  "restoration": {
    "strategy": "forward_commit",
    "history_preserved": true
  },
  "witness": {
    "required": true,
    "name_delivery_plainly": true
  },
  "human_correction": {
    "expected_max_minutes": null
  },
  "initiative": {
    "public_or_consequential": false,
    "max_unreviewed_minutes": null,
    "max_unreviewed_actions": 1
  }
}
