{
  "format": "reciprocal-delegation/0.1",
  "delegation_id": "RD-EXAMPLE-LATENCY-FAIL-001",
  "object": {
    "kind": "branch",
    "ref": "gh-pages",
    "base_head": "public-head-before-change"
  },
  "actor": {
    "role": "publisher",
    "aperture": "example-aperture"
  },
  "consequence_class": "routine_reversible",
  "write_scope": [
    "gh-pages"
  ],
  "no_touch": [
    "account-settings",
    "credentials"
  ],
  "evidence_obligation": [
    "declared output hash",
    "public commit sha",
    "served-origin receipt"
  ],
  "closer": {
    "kind": "human",
    "ref": "Mark"
  },
  "authorization": {
    "required": false,
    "request_id": null,
    "approval_token": null,
    "approval_received": false,
    "approval_value": null,
    "routine_phrase_is_not_authorization": true
  },
  "claim_binding": {
    "target_head": "public-head-before-change",
    "moved_head_becomes_historical": true
  },
  "mutation_controls": {
    "mutates": true,
    "claim_before_build": true,
    "exact_head_before_push": true,
    "single_mutator": true
  },
  "repair_controls": {
    "is_repair": false,
    "defect_id": null,
    "matching_failure_control": null
  },
  "restoration": {
    "strategy": "forward_commit",
    "history_preserved": true
  },
  "witness": {
    "required": true,
    "name_delivery_plainly": true
  },
  "human_correction": {
    "expected_max_minutes": 60
  },
  "initiative": {
    "public_or_consequential": true,
    "max_unreviewed_minutes": 120,
    "max_unreviewed_actions": 1
  }
}
